address,price,bedrooms,bathrooms,square_feet,year_built,property_tax,mls_number,neighborhood,commute_time_text,commute_time_seconds,distance_text,distance_value,mode
"236 Rideau St, Sandy Hill, Ottawa, ON K1Y 9V4",846748,6,4,1064,1980,8467,M8608811,Sandy Hill,9 mins,540,4 km,4000,driving
"677 Bank St, Barrhaven, Ottawa, ON K1R 8Z7",657906,4,4,2932,1929,6579,M5123451,Barrhaven,31 mins,1860,14 km,14000,driving
"384 Laurier St, Orleans, Ottawa, ON K1R 4U3",807853,3,3,2206,1928,8078,M6368747,Orleans,33 mins,1980,10 km,10000,driving
"970 Laurier St, Hintonburg, Ottawa, ON K1Z 7F1",884541,3,4,1170,2012,8845,M8746343,Hintonburg,20 mins,1200,22 km,22000,driving
"1346 O'Connor St, Sandy Hill, Ottawa, ON K1V 9B6",559822,4,4,1655,1974,5598,M7326214,Sandy Hill,15 mins,900,9 km,9000,driving
"804 Laurier St, Rockcliffe Park, Ottawa, ON K1V 6L0",827307,4,2,2469,1991,8273,M4582791,Rockcliffe Park,31 mins,1860,10 km,10000,driving
"1589 Wellington St, Sandy Hill, Ottawa, ON K1V 2L9",561545,4,3,1584,1969,5615,M6810304,Sandy Hill,9 mins,540,8 km,8000,driving
